{"checks":[{"check":"PATH_FORM","result":"PASSED"},{"check":"BYTES_HASH","result":"PASSED"},{"check":"LAYOUT","result":"PASSED"},{"check":"QUANTITY_IDENTITY","result":"PASSED"},{"check":"PAYLOAD","result":"ADMITTED"}],"consumer_request":{"consumer_id":"consumer-1","item":{"candidate_id":"syn-a2","conformer_id":null,"metric_name":"syn-a:/iptm","target_id":"syn-target"},"quantity":{"category":"model_confidence","context":"complex","quantity_id":"syn-iptm","scale":"0-1","unit":null}},"payload":{"reason":null,"status":"ADMITTED","value":0.71},"producer":{"artifact_id":"producer-a","layout":"candidate_evidence_list_v1","sha256":"4c590e6f547cc07d937b1da02c0c732aaf5e8f852a87b969b9aef97a369c1776","summary_id":null},"quantity_identity":{"locator":{"candidate_id":"syn-a2","conformer_id":null,"metric_index":0,"metric_name":"syn-a:/iptm","producer_provenance":{"checkpoint_id":null,"model_id":"synthetic-model","seed":0},"record_index":1,"source":{"path":"/synthetic/producer-a/confidence.json","row":null,"sha256":"f8546546c0c04ca3c0eabf21e8326077d7792095fb178e9d4b3dd05a3b3a3773"},"target_id":"syn-target"},"verified_definition":{"category":"model_confidence","context":"complex","scale":"0-1","unit":null}},"schema_version":"linked_transfer/1","transfer_id":"e57128a2be4727049c883c4d012f103981b32f937bb50ed48cd2e2633e977935"}
