{"checks":[{"check":"PATH_FORM","result":"PASSED"},{"check":"BYTES_HASH","result":"PASSED"},{"check":"LAYOUT","result":"PASSED"},{"check":"QUANTITY_IDENTITY","result":"PASSED"},{"check":"PAYLOAD","result":"ADMITTED"}],"consumer_request":{"consumer_id":"consumer-1","item":{"statistic":"median"},"quantity":{"category":"model_confidence","context":"complex","quantity_id":"syn-iptm","scale":"0-1","unit":null}},"payload":{"reason":null,"status":"ADMITTED","value":0.665},"producer":{"artifact_id":"summary-abc","layout":"quantity_summary_v1","sha256":"6ba46f34c012238f20f6395fe399aba13bf199260bcff940d71e488906989e7c","summary_id":"e56df891e65f3e427c3b1b2877185a6e0fc4c8feaf3f3e626be44fc3e7075f6d"},"quantity_identity":{"locator":{"count":4,"quantity_id":"syn-iptm","statistic":"median","statistics_status":"SUMMARIZED","summary_id":"e56df891e65f3e427c3b1b2877185a6e0fc4c8feaf3f3e626be44fc3e7075f6d"},"verified_definition":{"category":"model_confidence","context":"complex","scale":"0-1","unit":null}},"schema_version":"linked_transfer/1","transfer_id":"285ef041aeec7ed070b470e10a289f3f583ee6d10e12f186fffac01c710ec4b0"}
